{
  "id": "localai",
  "name": "LocalAI",
  "version": "1.0.1",
  "author": "CW",
  "description": "Models available on a LocalAI / OpenAI-compatible server.",
  "client": "client.js",
  "supportedSizes": ["quarter", "half", "full"],
  "config": {
    "url": { "type": "string", "label": "Server URL", "default": "http://192.168.1.240:30286" }
  }
}
